{
  "schema_version": "1.0",
  "catalog_type": "mechanic_package",
  "package_id": "trigger.standard",
  "category": "trigger",
  "version": "2.1.0",
  "mechanics": [
    {
      "mechanic_id": "trigger.symbol-count",
      "name_zh": "符号计数触发",
      "display_order": 500,
      "definition": "在指定盘面、步骤或完整入口范围内，合格符号数量满足阈值规则后进入由节点引用唯一标识的目标Feature或奖励状态。",
      "required_attributes": ["eligible_symbol_domain", "count_scope", "threshold_rule", "evaluation_timing", "target_node_id", "target_kind", "position_pattern_representation", "position_pattern_coordinate_domain"],
      "optional_attributes": ["mode_restrictions", "position_restrictions", "wild_count_rule", "consumption_rule"],
      "metric_requirements": {
        "required_packages": ["atomic.trigger"],
        "conditional_packages": []
      },
      "evidence_signatures": ["eligible symbol count and threshold evaluation are observable", "the matching count event is linked to an explicit transition into the referenced target node"],
      "exclusions": ["random transition not caused by visible or state-held symbol count", "symbol count pays directly but causes no state transition", "persistent state reaches a threshold after multiple entries"]
    },
    {
      "mechanic_id": "trigger.random-event",
      "name_zh": "随机事件触发",
      "display_order": 510,
      "definition": "在明确合格机会中，由独立随机事件决定是否进入由节点引用唯一标识的目标Feature或奖励状态，触发结果不能由当前可见符号条件确定。",
      "required_attributes": ["eligibility_scope", "evaluation_timing", "random_source", "target_node_id", "target_kind"],
      "optional_attributes": ["mode_restrictions", "state_condition", "probability_domain", "presentation_rule"],
      "metric_requirements": {
        "required_packages": ["atomic.trigger"],
        "conditional_packages": []
      },
      "evidence_signatures": ["a distinct RNG decision or protocol event precedes the feature transition", "identical visible symbol conditions can produce trigger and non-trigger outcomes under eligible state"],
      "exclusions": ["visible symbol count or pattern fully determines the transition", "a persistent state threshold deterministically causes entry", "the random event only selects an award inside an already entered feature"]
    },
    {
      "mechanic_id": "trigger.state-threshold",
      "name_zh": "状态阈值触发",
      "display_order": 520,
      "definition": "命名持久状态节点的状态变量达到或跨越明确阈值后，在规定时点进入由节点引用唯一标识的目标Feature或奖励状态。",
      "required_attributes": ["state_node_id", "state_id", "threshold_rule", "evaluation_timing", "target_node_id", "target_kind"],
      "optional_attributes": ["crossing_direction", "consumption_or_reset_rule", "mode_restrictions", "multiple_threshold_priority"],
      "metric_requirements": {
        "required_packages": ["atomic.trigger"],
        "conditional_packages": []
      },
      "evidence_signatures": ["state value before and after the triggering update is observable", "the threshold evaluation and target transition are linked in the state chain"],
      "exclusions": ["a single-board symbol count directly triggers without persistent state", "independent random event triggers below the threshold", "threshold only changes a multiplier or level without entering a target state"]
    }
  ]
}
